id,guid,published_on,imageurl,title,url,body,tags,lang,upvotes,downvotes,categories,source_info,source,text,title_sentiment,text_sentiment,sentiment
49665978,https://www.newsbtc.com/?p=800138,2025-08-07 01:00:06,https://resources.cryptocompare.com/news/21/49665978.jpeg,Binance Data Shows Decline in Leverage: Is a Major Crypto Shakeout Coming?,https://www.newsbtc.com/news/binance-data-shows-decline-in-leverage-is-a-major-crypto-shakeout-coming/,"The global cryptocurrency market has experienced a slight downturn over the past week, with Bitcoin (BTC) struggling to regain its recent highs. Market data from CoinGecko shows the total crypto market capitalization currently stands at approximately $3.79 trillion, representing a 0.4% decline in the last 24 hours. This pullback follows a period of uncertainty across major digital assets, with both Bitcoin and altcoins facing limited buying momentum despite periods of volatility. Analysts suggest that reduced market activity and fluctuations in leveraged trading positions are playing a significant role in current market behavior. Insights from Binance, one of the largest cryptocurrency exchanges globally, highlight shifting trader sentiment as leverage levels decline while overall price movement remains subdued. These changes raise questions about whether the market is entering a phase of consolidation or setting up for more volatility ahead. Related Reading: Bitcoin Inflows To Binance Accelerate: Investor Behavior Shifts After Months Of Decline Leverage Trends on Binance Point to Market Reset According to a recent analysis from CryptoQuant contributor Arab Chain, leverage usage on Binance has decreased notably in recent days. The analyst explains that falling leverage is typically a short-term positive indicator as it suggests the exit of overleveraged traders and a reduction in forced liquidations. This can help stabilize price fluctuations and reduce abrupt sell-offs that often trigger sharp market corrections. However, Arab Chain points out that the current scenario differs slightly. Both price levels and leverage ratios have declined simultaneously, indicating that spot market buying has not picked up to offset selling activity. “The lack of strong demand in the spot market weakens the probability of a rapid recovery,” the analyst wrote. This trend highlights a more cautious approach from traders, potentially reflecting macroeconomic uncertainties or a wait-and-see attitude ahead of key market developments. The estimated leverage ratio on Binance is considered a critical indicator for short-term sentiment. A high leverage ratio suggests speculative positions are dominating the market, making it more vulnerable to sudden price swings. Conversely, a falling ratio can indicate risk management among traders or widespread liquidations, both of which can temporarily ease volatility. Arab Chain emphasizes that this metric acts as an “early radar” for potential shifts in market momentum. Altcoin Deposits Signal Increased Trading Activity In a separate analysis, CryptoQuant’s Maartunn observed a significant increase in altcoin deposits to Binance, with a seven-day transaction count exceeding 45,000, the highest level since late 2024. This surge in activity coincided with Bitcoin’s recent push above $112,000, suggesting traders are preparing to adjust their positions across a wider range of digital assets. Deposits to exchanges are often interpreted as a signal of upcoming trading activity, as funds are moved from wallets to platforms where they can be quickly exchanged. Whether this results in increased buying or selling depends on how the broader market evolves in the coming days. The uptick in deposits could indicate growing interest in altcoins as traders look for opportunities beyond Bitcoin amid its recent stagnation. Featured image created with DALL-E, Chart from TradingView",Cryptocurrency Market News|altcoin|Binance|bitcoin|btc|BTCUSDT|crypto|crypto market|cryptocurrency,EN,0,0,MARKET|BNB|EXCHANGE|BTC|TRADING,"{'name': 'NewsBTC', 'img': 'https://images.cryptocompare.com/news/default/newsbtc.png', 'lang': 'EN'}",newsbtc,"Binance Data Shows Decline in Leverage: Is a Major Crypto Shakeout Coming?. The global cryptocurrency market has experienced a slight downturn over the past week, with Bitcoin (BTC) struggling to regain its recent highs. Market data from CoinGecko shows the total crypto market capitalization currently stands at approximately $3.79 trillion, representing a 0.4% decline in the last 24 hours. This pullback follows a period of uncertainty across major digital assets, with both Bitcoin and altcoins facing limited buying momentum despite periods of volatility. Analysts suggest that reduced market activity and fluctuations in leveraged trading positions are playing a significant role in current market behavior. Insights from Binance, one of the largest cryptocurrency exchanges globally, highlight shifting trader sentiment as leverage levels decline while overall price movement remains subdued. These changes raise questions about whether the market is entering a phase of consolidation or setting up for more volatility ahead. Related Reading: Bitcoin Inflows To Binance Accelerate: Investor Behavior Shifts After Months Of Decline Leverage Trends on Binance Point to Market Reset According to a recent analysis from CryptoQuant contributor Arab Chain, leverage usage on Binance has decreased notably in recent days. The analyst explains that falling leverage is typically a short-term positive indicator as it suggests the exit of overleveraged traders and a reduction in forced liquidations. This can help stabilize price fluctuations and reduce abrupt sell-offs that often trigger sharp market corrections. However, Arab Chain points out that the current scenario differs slightly. Both price levels and leverage ratios have declined simultaneously, indicating that spot market buying has not picked up to offset selling activity. “The lack of strong demand in the spot market weakens the probability of a rapid recovery,” the analyst wrote. This trend highlights a more cautious approach from traders, potentially reflecting macroeconomic uncertainties or a wait-and-see attitude ahead of key market developments. The estimated leverage ratio on Binance is considered a critical indicator for short-term sentiment. A high leverage ratio suggests speculative positions are dominating the market, making it more vulnerable to sudden price swings. Conversely, a falling ratio can indicate risk management among traders or widespread liquidations, both of which can temporarily ease volatility. Arab Chain emphasizes that this metric acts as an “early radar” for potential shifts in market momentum. Altcoin Deposits Signal Increased Trading Activity In a separate analysis, CryptoQuant’s Maartunn observed a significant increase in altcoin deposits to Binance, with a seven-day transaction count exceeding 45,000, the highest level since late 2024. This surge in activity coincided with Bitcoin’s recent push above $112,000, suggesting traders are preparing to adjust their positions across a wider range of digital assets. Deposits to exchanges are often interpreted as a signal of upcoming trading activity, as funds are moved from wallets to platforms where they can be quickly exchanged. Whether this results in increased buying or selling depends on how the broader market evolves in the coming days. The uptick in deposits could indicate growing interest in altcoins as traders look for opportunities beyond Bitcoin amid its recent stagnation. Featured image created with DALL-E, Chart from TradingView",-0.3774,0.4926,0.1566
49665818,content_6893ea715b3f8b2f08e5b2d2,2025-08-07 00:55:13,https://resources.cryptocompare.com/news/94/49665818.jpeg,What’s Next For Ether Prices?,https://www.forbes.com/sites/digital-assets/2025/08/06/whats-next-for-ether-prices/,"Ether has been trading within a relatively modest range in August, following a big month where notable government developments helped boost regulatory clarity for crypto.",Forbes Digital Assets|/digital-assets|Forbes Digital Assets|/digital-assets|standard,EN,0,0,MARKET|TRADING,"{'name': 'Forbes Digital Assets', 'img': 'https://resources.cryptocompare.com/news/94/default.png', 'lang': 'EN'}",forbes,"What’s Next For Ether Prices?. Ether has been trading within a relatively modest range in August, following a big month where notable government developments helped boost regulatory clarity for crypto.",0.0,0.6597,0.6597
49665825,https://bitcoinworld.co.in/?p=186464,2025-08-07 00:55:11,https://resources.cryptocompare.com/news/82/49665825.jpeg,Altcoin Season Index Drops: Is the Crypto Market Entering a New Era of Bitcoin Dominance?,https://bitcoinworld.co.in/altcoin-season-index-drops-3/,"BitcoinWorld Altcoin Season Index Drops: Is the Crypto Market Entering a New Era of Bitcoin Dominance? The cryptocurrency world is always in motion, and understanding its shifts is key to navigating its often-volatile waters. Recently, a significant indicator, the Altcoin Season Index , has captured the attention of many. This crucial metric, tracked by CoinMarketCap (CMC), recently registered a value of 36. This figure, down from previous days, signals a clear shift: the crypto market is currently experiencing what is known as Bitcoin Season . What Does the Altcoin Season Index Really Tell Us? The Altcoin Season Index is more than just a number; it is a snapshot of the broader cryptocurrency landscape. It helps investors understand whether altcoins (any cryptocurrency other than Bitcoin) are outperforming Bitcoin or vice versa. This index, which carefully excludes stablecoins and wrapped tokens, compares the 90-day performance of the top 100 coins listed on CMC against Bitcoin. An index score ranging from 1 to 100. Altcoin Season : Occurs when at least 75% of the top 100 altcoins outperform Bitcoin over the past 90 days. Bitcoin Season : Indicated when 25% or fewer of these altcoins manage to outperform Bitcoin. With the index now at 36, it strongly suggests that Bitcoin has been the dominant performer, leading the current market trends . Why Are We Seeing Bitcoin Season Now? The shift to Bitcoin Season is a natural part of the cryptocurrency cycle. Bitcoin often acts as a bellwether for the entire crypto market . When uncertainty rises or institutional interest focuses on established assets, capital tends to flow back into Bitcoin. This strengthens its position relative to altcoins. Several factors can contribute to this phenomenon: Market Stability Seeking : Investors often view Bitcoin as a safer haven during periods of high volatility or macroeconomic concerns. Dominance Cycle : Bitcoin’s price movements frequently dictate the overall direction of the market, influencing altcoin performance . Liquidity Concentration : Larger capital inflows often target Bitcoin first due to its superior liquidity and market capitalization. This dynamic often means that even if altcoins are seeing some gains, Bitcoin’s gains are comparatively larger, leading to a lower Altcoin Season Index . Navigating the Current Crypto Market: What Does This Mean for Your Portfolio? Understanding that we are in Bitcoin Season can help investors adjust their strategies. It is not necessarily a negative signal, but rather an indication of where current capital flows are concentrated. For many, this period might present different opportunities and challenges. Consider these actionable insights: Focus on Bitcoin : If your portfolio is heavily diversified into altcoins, this might be a time to re-evaluate your Bitcoin exposure. Strategic Altcoin Positioning : For those holding altcoins, research projects with strong fundamentals that might weather the Bitcoin Season better or be poised for future growth when the cycle shifts. Risk Management : Periods of Bitcoin dominance can sometimes precede broader market corrections for altcoins, making risk management even more crucial. Monitoring the Altcoin Season Index allows you to make informed decisions based on prevailing market trends . Looking Ahead: Will Altcoin Performance Rebound? The cryptocurrency market is cyclical, and periods of Bitcoin Season eventually give way to Altcoin Season , and vice-versa. While the current Altcoin Season Index suggests Bitcoin’s dominance, this does not mean altcoins are irrelevant. Historically, altcoins have shown incredible resilience and potential for significant gains once market sentiment shifts or specific narratives emerge. Factors that could signal a return to strong altcoin performance include: Sustained Bitcoin price stability or consolidation. Breakthroughs in specific altcoin projects or ecosystems (e.g., Layer 2 solutions, DeFi innovations). Increased retail investor interest spreading beyond Bitcoin. Keeping an eye on these broader market trends and technological advancements within the altcoin space is essential for long-term success. In conclusion, the Altcoin Season Index at 36 clearly indicates that the crypto market is currently in Bitcoin Season . This phase highlights Bitcoin’s current strength and influences altcoin performance . While it calls for a strategic approach to your portfolio, remember that market cycles are dynamic. Staying informed about these crucial market trends and understanding what drives them will empower you to make more confident decisions in the ever-evolving world of digital assets. Frequently Asked Questions (FAQs) Q1: What is the Altcoin Season Index? The Altcoin Season Index is a metric from CoinMarketCap that tracks whether altcoins (cryptocurrencies other than Bitcoin) are outperforming Bitcoin over a 90-day period. It ranges from 1 to 100. Q2: How is Altcoin Season determined? Altcoin Season occurs when at least 75% of the top 100 altcoins (excluding stablecoins and wrapped tokens) have outperformed Bitcoin over the last 90 days. Q3: What does it mean to be in Bitcoin Season? Bitcoin Season means that Bitcoin has been the dominant performer. This happens when 25% or fewer of the top 100 altcoins have outperformed Bitcoin over the past 90 days, as indicated by the Altcoin Season Index. Q4: How does Bitcoin Season impact altcoin performance? During Bitcoin Season, altcoins generally see less significant gains compared to Bitcoin, or they may even decline in value relative to Bitcoin. Capital tends to flow more towards Bitcoin as investors seek stability or leadership from the largest cryptocurrency. Q5: Is Bitcoin Season a bad thing for crypto investors? Not necessarily. Bitcoin Season is a normal part of the crypto market cycle. It suggests where the current market strength lies. For investors, it can be a time to consolidate positions, re-evaluate risk, and strategically plan for future shifts back to altcoin dominance. Did you find this analysis helpful? Share this article with your friends and fellow crypto enthusiasts on social media to help them understand the current market dynamics! To learn more about the latest crypto market trends, explore our article on key developments shaping Bitcoin price action. This post Altcoin Season Index Drops: Is the Crypto Market Entering a New Era of Bitcoin Dominance? first appeared on BitcoinWorld and is written by Editorial Team",Crypto News|ALTCOINS|BITCOIN|Crypto|Index|MarketAnalysis,EN,0,0,BTC|MARKET|ALTCOIN|BUSINESS|TRADING,"{'name': 'Bitcoin World', 'img': 'https://resources.cryptocompare.com/news/82/default.png', 'lang': 'EN'}",bitcoinworld,"Altcoin Season Index Drops: Is the Crypto Market Entering a New Era of Bitcoin Dominance?. BitcoinWorld Altcoin Season Index Drops: Is the Crypto Market Entering a New Era of Bitcoin Dominance? The cryptocurrency world is always in motion, and understanding its shifts is key to navigating its often-volatile waters. Recently, a significant indicator, the Altcoin Season Index , has captured the attention of many. This crucial metric, tracked by CoinMarketCap (CMC), recently registered a value of 36. This figure, down from previous days, signals a clear shift: the crypto market is currently experiencing what is known as Bitcoin Season . What Does the Altcoin Season Index Really Tell Us? The Altcoin Season Index is more than just a number; it is a snapshot of the broader cryptocurrency landscape. It helps investors understand whether altcoins (any cryptocurrency other than Bitcoin) are outperforming Bitcoin or vice versa. This index, which carefully excludes stablecoins and wrapped tokens, compares the 90-day performance of the top 100 coins listed on CMC against Bitcoin. An index score ranging from 1 to 100. Altcoin Season : Occurs when at least 75% of the top 100 altcoins outperform Bitcoin over the past 90 days. Bitcoin Season : Indicated when 25% or fewer of these altcoins manage to outperform Bitcoin. With the index now at 36, it strongly suggests that Bitcoin has been the dominant performer, leading the current market trends . Why Are We Seeing Bitcoin Season Now? The shift to Bitcoin Season is a natural part of the cryptocurrency cycle. Bitcoin often acts as a bellwether for the entire crypto market . When uncertainty rises or institutional interest focuses on established assets, capital tends to flow back into Bitcoin. This strengthens its position relative to altcoins. Several factors can contribute to this phenomenon: Market Stability Seeking : Investors often view Bitcoin as a safer haven during periods of high volatility or macroeconomic concerns. Dominance Cycle : Bitcoin’s price movements frequently dictate the overall direction of the market, influencing altcoin performance . Liquidity Concentration : Larger capital inflows often target Bitcoin first due to its superior liquidity and market capitalization. This dynamic often means that even if altcoins are seeing some gains, Bitcoin’s gains are comparatively larger, leading to a lower Altcoin Season Index . Navigating the Current Crypto Market: What Does This Mean for Your Portfolio? Understanding that we are in Bitcoin Season can help investors adjust their strategies. It is not necessarily a negative signal, but rather an indication of where current capital flows are concentrated. For many, this period might present different opportunities and challenges. Consider these actionable insights: Focus on Bitcoin : If your portfolio is heavily diversified into altcoins, this might be a time to re-evaluate your Bitcoin exposure. Strategic Altcoin Positioning : For those holding altcoins, research projects with strong fundamentals that might weather the Bitcoin Season better or be poised for future growth when the cycle shifts. Risk Management : Periods of Bitcoin dominance can sometimes precede broader market corrections for altcoins, making risk management even more crucial. Monitoring the Altcoin Season Index allows you to make informed decisions based on prevailing market trends . Looking Ahead: Will Altcoin Performance Rebound? The cryptocurrency market is cyclical, and periods of Bitcoin Season eventually give way to Altcoin Season , and vice-versa. While the current Altcoin Season Index suggests Bitcoin’s dominance, this does not mean altcoins are irrelevant. Historically, altcoins have shown incredible resilience and potential for significant gains once market sentiment shifts or specific narratives emerge. Factors that could signal a return to strong altcoin performance include: Sustained Bitcoin price stability or consolidation. Breakthroughs in specific altcoin projects or ecosystems (e.g., Layer 2 solutions, DeFi innovations). Increased retail investor interest spreading beyond Bitcoin. Keeping an eye on these broader market trends and technological advancements within the altcoin space is essential for long-term success. In conclusion, the Altcoin Season Index at 36 clearly indicates that the crypto market is currently in Bitcoin Season . This phase highlights Bitcoin’s current strength and influences altcoin performance . While it calls for a strategic approach to your portfolio, remember that market cycles are dynamic. Staying informed about these crucial market trends and understanding what drives them will empower you to make more confident decisions in the ever-evolving world of digital assets. Frequently Asked Questions (FAQs) Q1: What is the Altcoin Season Index? The Altcoin Season Index is a metric from CoinMarketCap that tracks whether altcoins (cryptocurrencies other than Bitcoin) are outperforming Bitcoin over a 90-day period. It ranges from 1 to 100. Q2: How is Altcoin Season determined? Altcoin Season occurs when at least 75% of the top 100 altcoins (excluding stablecoins and wrapped tokens) have outperformed Bitcoin over the last 90 days. Q3: What does it mean to be in Bitcoin Season? Bitcoin Season means that Bitcoin has been the dominant performer. This happens when 25% or fewer of the top 100 altcoins have outperformed Bitcoin over the past 90 days, as indicated by the Altcoin Season Index. Q4: How does Bitcoin Season impact altcoin performance? During Bitcoin Season, altcoins generally see less significant gains compared to Bitcoin, or they may even decline in value relative to Bitcoin. Capital tends to flow more towards Bitcoin as investors seek stability or leadership from the largest cryptocurrency. Q5: Is Bitcoin Season a bad thing for crypto investors? Not necessarily. Bitcoin Season is a normal part of the crypto market cycle. It suggests where the current market strength lies. For investors, it can be a time to consolidate positions, re-evaluate risk, and strategically plan for future shifts back to altcoin dominance. Did you find this analysis helpful? Share this article with your friends and fellow crypto enthusiasts on social media to help them understand the current market dynamics! To learn more about the latest crypto market trends, explore our article on key developments shaping Bitcoin price action. This post Altcoin Season Index Drops: Is the Crypto Market Entering a New Era of Bitcoin Dominance? first appeared on BitcoinWorld and is written by Editorial Team",0.2023,0.9986,0.9986
49665772,https://cointelegraph.com/news/iren-mines-more-bitcoin-mara-holdings-in-july,2025-08-07 00:52:54,https://images.cryptocompare.com/news/default/cointelegraph.png,IREN soars 11% after mining more Bitcoin than MARA in July,https://cointelegraph.com/news/iren-mines-more-bitcoin-mara-holdings-in-july?utm_source=rss_feed&utm_medium=rss&utm_campaign=rss_partner_inbound,Shares in IREN Ltd closed trading on Wednesday up 11.4% after it reported mining more Bitcoin than MARA Holdings in July.,,EN,0,0,BTC|MINING|TRADING,"{'name': 'CoinTelegraph', 'img': 'https://images.cryptocompare.com/news/default/cointelegraph.png', 'lang': 'EN'}",cointelegraph,IREN soars 11% after mining more Bitcoin than MARA in July. Shares in IREN Ltd closed trading on Wednesday up 11.4% after it reported mining more Bitcoin than MARA Holdings in July.,0.0,0.296,0.296
