id,guid,published_on,imageurl,title,url,body,tags,lang,upvotes,downvotes,categories,source_info,source,text,title_sentiment,text_sentiment,sentiment
49670164,https://www.newsbtc.com/?p=800359,2025-08-07 03:00:59,https://resources.cryptocompare.com/news/21/49670164.jpeg,Cardano (ADA) Targets $0.80 As Price Retests Key Level – Is An 85% Jump Ahead?,https://www.newsbtc.com/news/cardano-ada-targets-0-80-is-an-85-jump-ahead/,"After recovering from its local lows, Cardano (ADA) is retesting a key area that could send the price to the next crucial resistance. Some analysts suggest that the cryptocurrency is preparing for a massive rally. Related Reading: Solana To Drop Before The ‘Real Move’? Analyst Forecasts New Highs In Q3 Cardano Retests Key Resistance Following last week’s drop to the $0.70 support, Cardano is attempting to break out of a crucial resistance level to continue its rally. The cryptocurrency has surged 8.8% from Friday’s low, retesting the $0.74-$0.76 area throughout this week. Notably, ADA has been hovering between the $0.65-$0.85 price range since the Q2 market recovery, briefly losing this area during the June pullback. However, the July market pump sent the altcoin to a four-month high of $0.93, sparking bullish sentiment among investors. Since then, Cardano has been in a downtrend, attempting to break out of the descending resistance for the past two weeks. Market watcher Sebastian noted that the cryptocurrency has repeatedly retested the $0.76 zone over the past few days, suggesting that “the more it tests it, the higher the likelihood to break it.” According to the analyst, ADA must reclaim the 50-day Moving Average (MA), which has served as a strong resistance and support level and coincides with the descending resistance breakout area. Following today’s performance, the altcoin has reclaimed the 50 MA indicator and eyes a retest of the $0.76 resistance. A breakout from this level would set the stage for a retest of the next crucial area between $0.79 and $0.80. “Getting back above $0.80 would confirm the trend reversal,” Sebastian affirmed. Meanwhile, a rejection from this area could propel Cardano to retest the recent lows and risk losing its local range again. ADA Breakout Eyes 85%-120% Rally Man of Bitcoin noted ADA’s recent performance, asserting that it is “now potentially working on a small 1-2 setup.” Based on this, he suggested that “as long as the price remains above the last swing low at $0.685, wave-5 of iii should follow next.” Meanwhile, analyst Ali Martinez highlighted that the cryptocurrency has been trading within a descending channel since its December 2024 high of $1.32. According to the chart, ADA retested the channel’s upper boundary for the first time in months during the July breakout but was ultimately rejected. Reclaiming the $0.76 could propel the altcoin to the channel’s resistance, and “a breakout above $0.84 could set Cardano on a path toward $1.30.” Additionally, Martinez asserted that “ADA is showing the same price structure as the last cycle, only this time, it’s unfolding more gradually. And it feels like we’re right at the beginning of an explosive move.” Similarly, Crypto Bullet stated that Cardano has been following a pattern over this cycle. Per the chart, the cryptocurrency has been trading down for months before breaking out and reaching new local highs. Related Reading: Is Bitcoin’s Price Discovery Rally Over? This Week’s Performance May Hold The Answer Last month, the cryptocurrency broke out of its eight-month downtrend, targeting a rally toward the $1.60 area. Now, ADA is retesting the descending resistance line, which could set up the stage for the 120% jump if the breakout is confirmed. As of this writing, Cardano is trading at $0.74, a 3% increase in the daily timeframe. Featured Image from Unsplash.com, Chart from TradingView.com",Cryptocurrency Market News|ADA|ADA analysis|ADA ATH|ADA breakout|ADAUSDT|Cardano|Cardano (ADA) Price|crypto analyst|crypto market correction|Crypto Market Recovery|Crypto trader,EN,0,0,ADA|TRADING|ALTCOIN|MARKET|BTC,"{'name': 'NewsBTC', 'img': 'https://images.cryptocompare.com/news/default/newsbtc.png', 'lang': 'EN'}",newsbtc,"Cardano (ADA) Targets $0.80 As Price Retests Key Level – Is An 85% Jump Ahead?. After recovering from its local lows, Cardano (ADA) is retesting a key area that could send the price to the next crucial resistance. Some analysts suggest that the cryptocurrency is preparing for a massive rally. Related Reading: Solana To Drop Before The ‘Real Move’? Analyst Forecasts New Highs In Q3 Cardano Retests Key Resistance Following last week’s drop to the $0.70 support, Cardano is attempting to break out of a crucial resistance level to continue its rally. The cryptocurrency has surged 8.8% from Friday’s low, retesting the $0.74-$0.76 area throughout this week. Notably, ADA has been hovering between the $0.65-$0.85 price range since the Q2 market recovery, briefly losing this area during the June pullback. However, the July market pump sent the altcoin to a four-month high of $0.93, sparking bullish sentiment among investors. Since then, Cardano has been in a downtrend, attempting to break out of the descending resistance for the past two weeks. Market watcher Sebastian noted that the cryptocurrency has repeatedly retested the $0.76 zone over the past few days, suggesting that “the more it tests it, the higher the likelihood to break it.” According to the analyst, ADA must reclaim the 50-day Moving Average (MA), which has served as a strong resistance and support level and coincides with the descending resistance breakout area. Following today’s performance, the altcoin has reclaimed the 50 MA indicator and eyes a retest of the $0.76 resistance. A breakout from this level would set the stage for a retest of the next crucial area between $0.79 and $0.80. “Getting back above $0.80 would confirm the trend reversal,” Sebastian affirmed. Meanwhile, a rejection from this area could propel Cardano to retest the recent lows and risk losing its local range again. ADA Breakout Eyes 85%-120% Rally Man of Bitcoin noted ADA’s recent performance, asserting that it is “now potentially working on a small 1-2 setup.” Based on this, he suggested that “as long as the price remains above the last swing low at $0.685, wave-5 of iii should follow next.” Meanwhile, analyst Ali Martinez highlighted that the cryptocurrency has been trading within a descending channel since its December 2024 high of $1.32. According to the chart, ADA retested the channel’s upper boundary for the first time in months during the July breakout but was ultimately rejected. Reclaiming the $0.76 could propel the altcoin to the channel’s resistance, and “a breakout above $0.84 could set Cardano on a path toward $1.30.” Additionally, Martinez asserted that “ADA is showing the same price structure as the last cycle, only this time, it’s unfolding more gradually. And it feels like we’re right at the beginning of an explosive move.” Similarly, Crypto Bullet stated that Cardano has been following a pattern over this cycle. Per the chart, the cryptocurrency has been trading down for months before breaking out and reaching new local highs. Related Reading: Is Bitcoin’s Price Discovery Rally Over? This Week’s Performance May Hold The Answer Last month, the cryptocurrency broke out of its eight-month downtrend, targeting a rally toward the $1.60 area. Now, ADA is retesting the descending resistance line, which could set up the stage for the 120% jump if the breakout is confirmed. As of this writing, Cardano is trading at $0.74, a 3% increase in the daily timeframe. Featured Image from Unsplash.com, Chart from TradingView.com",0.0,0.9809,0.9812
49670205,https://en.bitcoinsistemi.com/?p=173707,2025-08-07 03:00:18,https://resources.cryptocompare.com/news/81/49670205.jpeg,Ripple Launches “National Trust Bank”—Could XRP and ETH Hit New ATHs?,https://en.bitcoinsistemi.com/ripple-launches-national-trust-bank-could-xrp-and-eth-hit-new-aths/,"Ripple is entering a new era of institutional dominance. In July 2025, the blockchain payments giant filed for a charter to launch Ripple National Trust Bank, a limited-purpose national trust bank headquartered in New York. The goal: provide enterprise-grade custody, tokenization infrastructure, and stablecoin management—without operating as a traditional deposit-taking bank. The move includes a request for a Federal Reserve Master Account, which would allow Ripple to directly access the U.S. payment system for settlement, a leap forward in integrating crypto into traditional banking. While the bank is still awaiting final regulatory approval, the announcement has already reignited market speculation, particularly around Ripple’s native token XRP and major assets like Ethereum. Meanwhile, early-stage altcoins like MAGACOIN FINANCE are catching tailwinds from the broader surge in institutional interest. XRP Testing Key Levels as Market Eyes $3.69 Currently trading between $3.03 and $3.07, XRP recently broke out of a downward channel but is now facing resistance at $3.14 and $3.34. Technical analysts note that a clean breakout above $3.34 could trigger a move toward $3.69 or even higher, particularly if regulatory clarity continues to improve. Ripple’s proposed bank could accelerate XRP adoption by boosting institutional trust. With a dedicated infrastructure for safeguarding reserves, managing RLUSD (Ripple’s stablecoin), and facilitating cross-border payments, XRP could find itself at the center of a more regulated and scalable payment system. The bullish scenario? A legal victory combined with a banking license approval—two catalysts that could launch XRP toward new highs. Ethereum Approaches $4,000 as Bulls Take Control Ethereum is trading strong between $3,555 and $3,720. After gaining more than 40% in the past month, ETH is showing resilience amid broader market volatility. Key resistance lies at $3,881 and $4,234, and analysts remain bullish provided ETH continues to defend the $3,400 range. Ethereum stands to benefit indirectly from Ripple’s banking play as well, given the broader legitimization of tokenized infrastructure and blockchain-integrated banking services. With ETH’s growing presence in tokenized treasuries, stablecoins, and DeFi infrastructure, any movement toward regulatory clarity tends to strengthen Ethereum’s investment case. Momentum with Fresh Capital Rotation into Breakout Contenders Ripple’s growing institutional influence is prompting early investors to explore the next big opportunity—especially among projects still in presale. That shift has brought major attention to MAGACOIN FINANCE, which has recently experienced a surge in whale inflows and early staking momentum. Ripple’s Trust Bank Launch Could Fuel MAGACOIN FINANCE 22,500% Gains—Outpacing XRP Projections , according to some analysts. The project is riding the wave of rising institutional appetite with a meme-fueled narrative, early timing, and strategic accumulation that’s beginning to resemble early DOGE and SHIBA cycles. Investors seeking asymmetrical upside are watching MAGACOIN FINANCE closely as ETF-driven inflows trickle down to presale markets. Conclusion: Ripple’s Banking Play Sets the Stage Ripple’s National Trust Bank proposal isn’t just another crypto headline—it’s a signal that blockchain is entering Wall Street’s core financial architecture. If approved, it could catapult XRP and ETH to new heights—and in doing so, may fuel a new generation of breakout altcoins. MAGACOIN FINANCE is already capturing that energy, one wallet at a time. To learn more about MAGACOIN FINANCE, visit: Website: https://magacoinfinance.com X: https://x.com/magacoinfinance Telegram: https://t.me/magacoinfinance Continue Reading: Ripple Launches “National Trust Bank”—Could XRP and ETH Hit New ATHs?",Sponsored,EN,0,0,ETH|XRP|FIAT|TRADING|MARKET,"{'name': 'BitcoinSistemi', 'img': 'https://resources.cryptocompare.com/news/81/default.png', 'lang': 'EN'}",bitcoinsistemi,"Ripple Launches “National Trust Bank”—Could XRP and ETH Hit New ATHs?. Ripple is entering a new era of institutional dominance. In July 2025, the blockchain payments giant filed for a charter to launch Ripple National Trust Bank, a limited-purpose national trust bank headquartered in New York. The goal: provide enterprise-grade custody, tokenization infrastructure, and stablecoin management—without operating as a traditional deposit-taking bank. The move includes a request for a Federal Reserve Master Account, which would allow Ripple to directly access the U.S. payment system for settlement, a leap forward in integrating crypto into traditional banking. While the bank is still awaiting final regulatory approval, the announcement has already reignited market speculation, particularly around Ripple’s native token XRP and major assets like Ethereum. Meanwhile, early-stage altcoins like MAGACOIN FINANCE are catching tailwinds from the broader surge in institutional interest. XRP Testing Key Levels as Market Eyes $3.69 Currently trading between $3.03 and $3.07, XRP recently broke out of a downward channel but is now facing resistance at $3.14 and $3.34. Technical analysts note that a clean breakout above $3.34 could trigger a move toward $3.69 or even higher, particularly if regulatory clarity continues to improve. Ripple’s proposed bank could accelerate XRP adoption by boosting institutional trust. With a dedicated infrastructure for safeguarding reserves, managing RLUSD (Ripple’s stablecoin), and facilitating cross-border payments, XRP could find itself at the center of a more regulated and scalable payment system. The bullish scenario? A legal victory combined with a banking license approval—two catalysts that could launch XRP toward new highs. Ethereum Approaches $4,000 as Bulls Take Control Ethereum is trading strong between $3,555 and $3,720. After gaining more than 40% in the past month, ETH is showing resilience amid broader market volatility. Key resistance lies at $3,881 and $4,234, and analysts remain bullish provided ETH continues to defend the $3,400 range. Ethereum stands to benefit indirectly from Ripple’s banking play as well, given the broader legitimization of tokenized infrastructure and blockchain-integrated banking services. With ETH’s growing presence in tokenized treasuries, stablecoins, and DeFi infrastructure, any movement toward regulatory clarity tends to strengthen Ethereum’s investment case. Momentum with Fresh Capital Rotation into Breakout Contenders Ripple’s growing institutional influence is prompting early investors to explore the next big opportunity—especially among projects still in presale. That shift has brought major attention to MAGACOIN FINANCE, which has recently experienced a surge in whale inflows and early staking momentum. Ripple’s Trust Bank Launch Could Fuel MAGACOIN FINANCE 22,500% Gains—Outpacing XRP Projections , according to some analysts. The project is riding the wave of rising institutional appetite with a meme-fueled narrative, early timing, and strategic accumulation that’s beginning to resemble early DOGE and SHIBA cycles. Investors seeking asymmetrical upside are watching MAGACOIN FINANCE closely as ETF-driven inflows trickle down to presale markets. Conclusion: Ripple’s Banking Play Sets the Stage Ripple’s National Trust Bank proposal isn’t just another crypto headline—it’s a signal that blockchain is entering Wall Street’s core financial architecture. If approved, it could catapult XRP and ETH to new heights—and in doing so, may fuel a new generation of breakout altcoins. MAGACOIN FINANCE is already capturing that energy, one wallet at a time. To learn more about MAGACOIN FINANCE, visit: Website: https://magacoinfinance.com X: https://x.com/magacoinfinance Telegram: https://t.me/magacoinfinance Continue Reading: Ripple Launches “National Trust Bank”—Could XRP and ETH Hit New ATHs?",0.5106,0.999,0.999
49670144,https://ambcrypto.com/?p=516999,2025-08-07 03:00:10,https://images.cryptocompare.com/news/default/ambcrypto.png,Indonesia’s Bitcoin Reserve could lock away 200K BTC: But is the country ready?,https://ambcrypto.com/indonesias-bitcoin-reserve-could-lock-away-200k-btc-but-is-the-country-ready/,Could this be a genius economic hedge or a risky leap?,Bitcoin|BTC Trading View|News|News 1|Social|Trading View|ambcrypto,EN,0,0,BTC|FIAT,"{'name': 'AMB Crypto', 'img': 'https://images.cryptocompare.com/news/default/ambcrypto.png', 'lang': 'EN'}",ambcrypto,Indonesia’s Bitcoin Reserve could lock away 200K BTC: But is the country ready?. Could this be a genius economic hedge or a risky leap?,0.5023,-0.2023,0.3421
