id,guid,published_on,imageurl,title,url,body,tags,lang,upvotes,downvotes,categories,source_info,source,text,title_sentiment,text_sentiment,sentiment
49667590,https://www.cryptopolitan.com/?p=780707,2025-08-07 01:40:59,https://resources.cryptocompare.com/news/43/49667590.jpeg,"UK economy prepares for fifth rate cut, BOE balances inflation spike",https://www.cryptopolitan.com/boe-set-to-cut-rates-to-two-year-low/,"The Bank of England (BoE) is expected to lower interest rates to 4%, their lowest level in more than two years, as it grapples with a weakening economy and a labor market hit by rising taxes. Economists and markets widely anticipate a 25 basis point cut , maintaining the central bank’s current once-per-quarter pace of monetary easing. The decision will be announced at 12 p.m. in London, followed by a press conference with Governor Andrew Bailey at 12:30 p.m. The rate cut would mark the fifth consecutive quarter-point reduction, bringing UK rates below those of the U.S. Federal Reserve, which last moved in 2024 and currently holds its benchmark at 4.25%–4.5%. The Monetary Policy Committee (MPC) is expected to stick with its cautious guidance of “gradual and careful” reductions, as inflation pressures re-emerge. June inflation came in at 3.6%, higher than the bank’s 3.4% forecast and its highest reading in 17 months, driven by surging energy and food prices. The BoE may now revise its near-term inflation outlook closer to 4% for the year. Governor Bailey has downplayed the spike as temporary, but Chief Economist Huw Pill and others have warned of second-round effects feeding into wages and core inflation. BoE faces mounting growth risks as job losses soar Meanwhile, growth concerns have intensified following back-to-back contractions in the spring and rising unemployment tied to April’s payroll tax and minimum wage hikes. More than 180,000 jobs have been lost since Chancellor Rachel Reeves announced a £26 billion increase in employer national insurance contributions, pushing the unemployment rate to a four-year high. The MPC is expected to highlight these labour market challenges in its updated projections. In May, it forecast growth of 1% in 2025 and 1.25% in 2026, though recent data suggests a potential upward revision after better-than-expected Q1 performance and an upgraded estimate for Q2 growth. The decision is likely to expose divisions within the nine-member MPC. A Bloomberg survey suggests a three-way split: most members favouring a 25bp cut, two pushing for a larger 50bp move, and two likely to vote for no change. Pill and external member Catherine Mann, who opposed cuts in May, are expected to maintain their stance, while Swati Dhingra and Alan Taylor may advocate for a more aggressive reduction. While today’s move is mostly priced in, traders will be watching closely for any change in forward guidance. Markets expect one more cut this year, likely in November, bringing the rate down to around 3.5% by 2026. “The risks are tilted in a hawkish direction,” said Dan Hanson, Chief UK Economist at Bloomberg Economics. “The committee may signal it’s rethinking its once-a-quarter pace, implying a November cut isn’t guaranteed.” BoE reconsiders bond sales strategy as long-dated gilt yields surge Attention is also turning to the BoE’s balance sheet reduction strategy. Quantitative tightening (QT) has already reduced bond holdings by about £100 billion annually, but market strain—especially in long-dated gilts—has sparked speculation that the BoE could slow or shift the pace of sales. Governor Bailey has recently flagged concerns over rising 30-year gilt yields, reaching levels last seen in the late 1990s. A pivot toward shorter-dated debt or a reduced pace of active sales (currently expected at £26 billion a year) may be under consideration ahead of the BoE’s September QT update. According to Sanjay Raja, Chief UK Economist at Deutsche Bank, a signal acknowledging long-end liquidity issues could foreshadow changes in the BoE’s sales strategy. Cryptopolitan Academy: Tired of market swings? Learn how DeFi can help you build steady passive income. Register Now",News|Bank of England,EN,0,0,MACROECONOMICS|MARKET|REGULATION|FIAT,"{'name': 'Cryptopolitan', 'img': 'https://images.cryptocompare.com/news/default/cryptopolitan.png', 'lang': 'EN'}",cryptopolitan,"UK economy prepares for fifth rate cut, BOE balances inflation spike. The Bank of England (BoE) is expected to lower interest rates to 4%, their lowest level in more than two years, as it grapples with a weakening economy and a labor market hit by rising taxes. Economists and markets widely anticipate a 25 basis point cut , maintaining the central bank’s current once-per-quarter pace of monetary easing. The decision will be announced at 12 p.m. in London, followed by a press conference with Governor Andrew Bailey at 12:30 p.m. The rate cut would mark the fifth consecutive quarter-point reduction, bringing UK rates below those of the U.S. Federal Reserve, which last moved in 2024 and currently holds its benchmark at 4.25%–4.5%. The Monetary Policy Committee (MPC) is expected to stick with its cautious guidance of “gradual and careful” reductions, as inflation pressures re-emerge. June inflation came in at 3.6%, higher than the bank’s 3.4% forecast and its highest reading in 17 months, driven by surging energy and food prices. The BoE may now revise its near-term inflation outlook closer to 4% for the year. Governor Bailey has downplayed the spike as temporary, but Chief Economist Huw Pill and others have warned of second-round effects feeding into wages and core inflation. BoE faces mounting growth risks as job losses soar Meanwhile, growth concerns have intensified following back-to-back contractions in the spring and rising unemployment tied to April’s payroll tax and minimum wage hikes. More than 180,000 jobs have been lost since Chancellor Rachel Reeves announced a £26 billion increase in employer national insurance contributions, pushing the unemployment rate to a four-year high. The MPC is expected to highlight these labour market challenges in its updated projections. In May, it forecast growth of 1% in 2025 and 1.25% in 2026, though recent data suggests a potential upward revision after better-than-expected Q1 performance and an upgraded estimate for Q2 growth. The decision is likely to expose divisions within the nine-member MPC. A Bloomberg survey suggests a three-way split: most members favouring a 25bp cut, two pushing for a larger 50bp move, and two likely to vote for no change. Pill and external member Catherine Mann, who opposed cuts in May, are expected to maintain their stance, while Swati Dhingra and Alan Taylor may advocate for a more aggressive reduction. While today’s move is mostly priced in, traders will be watching closely for any change in forward guidance. Markets expect one more cut this year, likely in November, bringing the rate down to around 3.5% by 2026. “The risks are tilted in a hawkish direction,” said Dan Hanson, Chief UK Economist at Bloomberg Economics. “The committee may signal it’s rethinking its once-a-quarter pace, implying a November cut isn’t guaranteed.” BoE reconsiders bond sales strategy as long-dated gilt yields surge Attention is also turning to the BoE’s balance sheet reduction strategy. Quantitative tightening (QT) has already reduced bond holdings by about £100 billion annually, but market strain—especially in long-dated gilts—has sparked speculation that the BoE could slow or shift the pace of sales. Governor Bailey has recently flagged concerns over rising 30-year gilt yields, reaching levels last seen in the late 1990s. A pivot toward shorter-dated debt or a reduced pace of active sales (currently expected at £26 billion a year) may be under consideration ahead of the BoE’s September QT update. According to Sanjay Raja, Chief UK Economist at Deutsche Bank, a signal acknowledging long-end liquidity issues could foreshadow changes in the BoE’s sales strategy. Cryptopolitan Academy: Tired of market swings? Learn how DeFi can help you build steady passive income. Register Now",-0.2732,-0.2172,-0.3425
49668534,484ba6da-1fdb-4af2-b227-a5e5cd25dcb6,2025-08-07 01:30:23,https://resources.cryptocompare.com/news/5/49668534.jpeg,Asia Morning Briefing: BTC Slips Into Low-Liquidity “Air Gap” as Post-ATH Drift Continues,https://www.coindesk.com/markets/2025/08/07/asia-morning-briefing-btc-slips-into-low-liquidity-air-gap-as-post-ath-drift-continues,"Good Morning, Asia. Here's what's making news in the markets: Welcome to Asia Morning Briefing, a daily summary of top stories during U.S. hours and an overview of market moves and analysis. For a detailed overview of U.S. markets, see CoinDesk's Crypto Daybook Americas. Bitcoin (BTC) is treading water around $115K Thursday morning in Asia, up 1% in the last 24 hours, as the post-all-time-high correction continues to play out across low volume and weak conviction. According to Glassnode , BTC has entered what it calls an “air gap”, a low-liquidity zone between $110,000 and $116,000, after breaking down from a major supply cluster where short-term holders had previously found support. These areas typically see little trading activity and can either serve as a base for accumulation or become a trapdoor for deeper downside if demand fails to return. “The market is effectively re-finding its footing,” Glassnode analysts wrote, describing the range between $110K (the prior ATH) and $116K (recent buyer cost basis) as the new battleground. They noted that while opportunistic buying has emerged, with 120,000 BTC acquired on the dip, prices have yet to reclaim resistance levels convincingly, particularly the ~$116.9K threshold that marks recent short-term holder entry points. Short-term holder profitability has dropped from 100% to 70%, which Glassnode frames as typical for a bull market mid-phase. But without fresh inflows, this could quickly erode sentiment. ETF flows have turned negative, with a -1.5K BTC outflow earlier this week, the largest since April. At the same time, funding rates in the derivatives market have cooled, reflecting reduced leverage and a more cautious stance among speculators. Market maker Enflux offered a similar take: “Crypto markets remain in a fragile holding pattern. Despite some relief in the altcoin space, majors like BTC and ETH are still struggling to inspire confidence,” it wrote in a client note. “The broader trend? Heavy legs with more or less light volume.” ETH is up 2% in the last 24 hours, trading just below $3,600. The CoinDesk 20 Index , which tracks a broad basket of crypto assets, gained 1.69% to 3,815.22. “Until BTC and ETH reclaim strength with volume,” Enflux added, “the path of least resistance could remain sideways to down.” The market’s next move likely hinges on whether buyers are willing to step in and build a base within this low-volume zone, or whether another flush toward $110K is needed to reset the trend. For now, traders remain cautious, and the bulls remain unproven. Market Movers: BTC: A potential Bitcoin supply shock, driven by drying OTC desk reserves and steady corporate accumulation, could “uncork” BTC price action after a dip below $110K, market observers say. ETH: Ethereum may have formed a local top as sell pressure hits $419 million, its second-highest on record, while ETH retests a major resistance zone near $4,000 that preceded a 66% drop in late 2024, raising the risk of a 25–35% decline by September; meanwhile, Polymarket bettors remain split, with 48% backing a rally to $5,000 despite the bearish signals. Gold: Gold's rally stalled Wednesday as traders took profits and weighed rising Fed rate cut odds, U.S. trade tensions, and a looming Fed leadership shakeup, leaving prices flat after a three-day gain driven by economic weakness; spot gold last traded at $3,372.11, down 0.24% on the day. Nikkei 225: Asia-Pacific markets opened mixed Thursday, with Japan’s Nikkei 225 flat, as investors shrugged off new U.S. semiconductor tariff threats. S&P 500: U.S. stock futures were flat Wednesday night as traders digested Trump’s new semiconductor tariffs, with the S&P 500 still up 1.7% for the week. Elsewhere in Crypto: Industry leaders cheer liquid staking's SEC green light, opening doors for institutional adoption (The Block) Roman Storm Guilty of Unlicensed Money Transmitting Conspiracy in Partial Verdict (CoinDesk) Trump Media Tests 'Truth Search' Using Perplexity AI (Decrypt)",Markets|btc|Bitcoin|News,EN,0,0,MARKET|BTC|ASIA|TRADING|ETH,"{'name': 'CoinDesk', 'img': 'https://resources.cryptocompare.com/news/5/default.png', 'lang': 'EN'}",coindesk,"Asia Morning Briefing: BTC Slips Into Low-Liquidity “Air Gap” as Post-ATH Drift Continues. Good Morning, Asia. Here's what's making news in the markets: Welcome to Asia Morning Briefing, a daily summary of top stories during U.S. hours and an overview of market moves and analysis. For a detailed overview of U.S. markets, see CoinDesk's Crypto Daybook Americas. Bitcoin (BTC) is treading water around $115K Thursday morning in Asia, up 1% in the last 24 hours, as the post-all-time-high correction continues to play out across low volume and weak conviction. According to Glassnode , BTC has entered what it calls an “air gap”, a low-liquidity zone between $110,000 and $116,000, after breaking down from a major supply cluster where short-term holders had previously found support. These areas typically see little trading activity and can either serve as a base for accumulation or become a trapdoor for deeper downside if demand fails to return. “The market is effectively re-finding its footing,” Glassnode analysts wrote, describing the range between $110K (the prior ATH) and $116K (recent buyer cost basis) as the new battleground. They noted that while opportunistic buying has emerged, with 120,000 BTC acquired on the dip, prices have yet to reclaim resistance levels convincingly, particularly the ~$116.9K threshold that marks recent short-term holder entry points. Short-term holder profitability has dropped from 100% to 70%, which Glassnode frames as typical for a bull market mid-phase. But without fresh inflows, this could quickly erode sentiment. ETF flows have turned negative, with a -1.5K BTC outflow earlier this week, the largest since April. At the same time, funding rates in the derivatives market have cooled, reflecting reduced leverage and a more cautious stance among speculators. Market maker Enflux offered a similar take: “Crypto markets remain in a fragile holding pattern. Despite some relief in the altcoin space, majors like BTC and ETH are still struggling to inspire confidence,” it wrote in a client note. “The broader trend? Heavy legs with more or less light volume.” ETH is up 2% in the last 24 hours, trading just below $3,600. The CoinDesk 20 Index , which tracks a broad basket of crypto assets, gained 1.69% to 3,815.22. “Until BTC and ETH reclaim strength with volume,” Enflux added, “the path of least resistance could remain sideways to down.” The market’s next move likely hinges on whether buyers are willing to step in and build a base within this low-volume zone, or whether another flush toward $110K is needed to reset the trend. For now, traders remain cautious, and the bulls remain unproven. Market Movers: BTC: A potential Bitcoin supply shock, driven by drying OTC desk reserves and steady corporate accumulation, could “uncork” BTC price action after a dip below $110K, market observers say. ETH: Ethereum may have formed a local top as sell pressure hits $419 million, its second-highest on record, while ETH retests a major resistance zone near $4,000 that preceded a 66% drop in late 2024, raising the risk of a 25–35% decline by September; meanwhile, Polymarket bettors remain split, with 48% backing a rally to $5,000 despite the bearish signals. Gold: Gold's rally stalled Wednesday as traders took profits and weighed rising Fed rate cut odds, U.S. trade tensions, and a looming Fed leadership shakeup, leaving prices flat after a three-day gain driven by economic weakness; spot gold last traded at $3,372.11, down 0.24% on the day. Nikkei 225: Asia-Pacific markets opened mixed Thursday, with Japan’s Nikkei 225 flat, as investors shrugged off new U.S. semiconductor tariff threats. S&P 500: U.S. stock futures were flat Wednesday night as traders digested Trump’s new semiconductor tariffs, with the S&P 500 still up 1.7% for the week. Elsewhere in Crypto: Industry leaders cheer liquid staking's SEC green light, opening doors for institutional adoption (The Block) Roman Storm Guilty of Unlicensed Money Transmitting Conspiracy in Partial Verdict (CoinDesk) Trump Media Tests 'Truth Search' Using Perplexity AI (Decrypt)",0.0,-0.7479,-0.7479
49667039,https://en.bitcoinsistemi.com/?p=173688,2025-08-07 01:30:15,https://resources.cryptocompare.com/news/81/49667039.jpeg,Solana Ships New Smartphone Worldwide — Is $500 Next for SOL?,https://en.bitcoinsistemi.com/solana-ships-new-smartphone-worldwide-is-500-next-for-sol/,"Solana is making headlines again – this time not just for its blazing-fast blockchain, but for its growing presence in consumer tech. The launch of its second-generation smartphone has captured the attention of both crypto investors and mobile tech enthusiasts. Meanwhile, early investors looking for the next big opportunity are also watching MAGACOIN FINANCE, a project gaining serious traction during its early stage with massive upside projections. Seeker Smartphone: A Web3 Powerhouse in Your Pocket Solana Mobile has begun shipping its new crypto-focused smartphone, the Seeker, to over 50 countries worldwide. With more than 150,000 units pre-ordered, it’s already outpacing the original Saga phone, which sold just 20,000. Retailing at $450–$500, the Seeker is expected to bring in at least $67.5 million in revenue. But what truly sets the Seeker apart is its deep integration with blockchain tools. It includes a hardware-isolated Seed Vault for securely storing private keys and recovery phrases, along with a decentralized app store that bypasses Apple and Google’s restrictive frameworks. This opens up direct access to NFTs, DeFi, games, and dApps—all without the usual 30% commissions or app store bans. New Contender Could Outperform Even Solana’s Gains While Solana is generating buzz with real-world products, MAGACOIN FINANCE is turning heads with numbers. With analysts forecasting up to 14,500% returns from its current stage, it’s quickly becoming one of the most talked-about altcoins of the year . As access tightens and allocations vanish, MAGACOIN FINANCE is drawing comparisons to early-stage SHIB and DOGE—but with a more advanced ecosystem in development. For those entering before major exchange listings, the potential could be enormous. Is $500 SOL a Realistic Target? The buzz around the Seeker has added fresh fuel to Solana’s price outlook . Already showing strength amid altcoin rotation, SOL could ride the wave of mobile adoption to new highs. Analysts point to key ecosystem metrics—DeFi TVL, NFT activity, and user growth—as signs of continued strength. If momentum holds, a run to $500 is within reach, especially considering the anticipation of spot ETF approval. Conclusion The Seeker’s launch marks a major step forward for crypto-native mobile tech, and Solana is leading the charge. But while SOL’s climb to $500 is drawing speculation, some investors are placing their bets on MAGACOIN FINANCE for even bigger returns . With limited access remaining and bold ROI projections , this might be the altcoin to watch as the next bull run unfolds. To learn more about MAGACOIN FINANCE, visit: Website: https://magacoinfinance.com Twitter/X: https://x.com/magacoinfinance Telegram: https://t.me/magacoinfinance Continue Reading: Solana Ships New Smartphone Worldwide — Is $500 Next for SOL?",Sponsored,EN,0,0,SOL|BUSINESS|ALTCOIN|BLOCKCHAIN|SPONSORED,"{'name': 'BitcoinSistemi', 'img': 'https://resources.cryptocompare.com/news/81/default.png', 'lang': 'EN'}",bitcoinsistemi,"Solana Ships New Smartphone Worldwide — Is $500 Next for SOL?. Solana is making headlines again – this time not just for its blazing-fast blockchain, but for its growing presence in consumer tech. The launch of its second-generation smartphone has captured the attention of both crypto investors and mobile tech enthusiasts. Meanwhile, early investors looking for the next big opportunity are also watching MAGACOIN FINANCE, a project gaining serious traction during its early stage with massive upside projections. Seeker Smartphone: A Web3 Powerhouse in Your Pocket Solana Mobile has begun shipping its new crypto-focused smartphone, the Seeker, to over 50 countries worldwide. With more than 150,000 units pre-ordered, it’s already outpacing the original Saga phone, which sold just 20,000. Retailing at $450–$500, the Seeker is expected to bring in at least $67.5 million in revenue. But what truly sets the Seeker apart is its deep integration with blockchain tools. It includes a hardware-isolated Seed Vault for securely storing private keys and recovery phrases, along with a decentralized app store that bypasses Apple and Google’s restrictive frameworks. This opens up direct access to NFTs, DeFi, games, and dApps—all without the usual 30% commissions or app store bans. New Contender Could Outperform Even Solana’s Gains While Solana is generating buzz with real-world products, MAGACOIN FINANCE is turning heads with numbers. With analysts forecasting up to 14,500% returns from its current stage, it’s quickly becoming one of the most talked-about altcoins of the year . As access tightens and allocations vanish, MAGACOIN FINANCE is drawing comparisons to early-stage SHIB and DOGE—but with a more advanced ecosystem in development. For those entering before major exchange listings, the potential could be enormous. Is $500 SOL a Realistic Target? The buzz around the Seeker has added fresh fuel to Solana’s price outlook . Already showing strength amid altcoin rotation, SOL could ride the wave of mobile adoption to new highs. Analysts point to key ecosystem metrics—DeFi TVL, NFT activity, and user growth—as signs of continued strength. If momentum holds, a run to $500 is within reach, especially considering the anticipation of spot ETF approval. Conclusion The Seeker’s launch marks a major step forward for crypto-native mobile tech, and Solana is leading the charge. But while SOL’s climb to $500 is drawing speculation, some investors are placing their bets on MAGACOIN FINANCE for even bigger returns . With limited access remaining and bold ROI projections , this might be the altcoin to watch as the next bull run unfolds. To learn more about MAGACOIN FINANCE, visit: Website: https://magacoinfinance.com Twitter/X: https://x.com/magacoinfinance Telegram: https://t.me/magacoinfinance Continue Reading: Solana Ships New Smartphone Worldwide — Is $500 Next for SOL?",0.0,0.9953,0.9953
